<?xml version='1.0' encoding='UTF-8'?>
<!DOCTYPE CompanyRegion [
<!ELEMENT CompanyRegion (CompanyInformation+)>
<!ELEMENT CompanyInformation (CompId,CompRegionId,CompTransPort,CompanyStreet,COMPANYINFO+)>
<!ELEMENT CompId (#PCDATA)>
<!ELEMENT CompRegionId (#PCDATA)>
<!ELEMENT CompTransPort (#PCDATA)>
<!ELEMENT CompanyStreet (#PCDATA)>

<!ELEMENT COMPANYINFO (CompInfoId,City,Address,Zip,Region,CEO,Office+)>
<!ELEMENT CompInfoId (#PCDATA)>
<!ELEMENT City (#PCDATA)>
<!ELEMENT Address (#PCDATA)>
<!ELEMENT Zip (#PCDATA)>
<!ELEMENT Region (#PCDATA)>
<!ELEMENT CEO (#PCDATA)>
  
<!ELEMENT Office (Department,Manager+)>
<!ELEMENT Department (#PCDATA)>
  
<!ELEMENT Manager (Name,Address)>
<!ELEMENT Name (#PCDATA)>
]>

<CompanyRegion>
  <CompanyInformation>
    <CompId>1</CompId>
    <CompRegionId>1000</CompRegionId>
    <CompTransPort>GMC</CompTransPort>
    <CompanyStreet>Brown</CompanyStreet>
    <COMPANYINFO>
      <CompInfoId>19-184-5116</CompInfoId>
      <City>Lexington</City>
      <Address>Oriole</Address>
      <Zip>40576</Zip>
      <Region>KY</Region>
      <CEO>Jannelle Sloane</CEO>
      <Office>
        <Department>Marketing</Department>
        <Manager>
          <Name>Terry Maillard</Name>
          <Address>69521 Sherman Plaza</Address>
        </Manager>
        <Manager>
          <Name>Clive Niess</Name>
          <Address>5 Elka Crossing</Address>
        </Manager>
      </Office>
      <Office>
        <Department>Services</Department>
        <Manager>
          <Name>Orin Kasper</Name>
          <Address>7546 Springs Avenue</Address>
        </Manager>
        <Manager>
          <Name>Meir Knock</Name>
          <Address>88394 Knutson Park</Address>
        </Manager>
      </Office>
    </COMPANYINFO>
    <COMPANYINFO>
      <CompInfoId>74-059-1956</CompInfoId>
      <City>Crawfordsville</City>
      <Address>High Crossing</Address>
      <Zip>47937</Zip>
      <Region>IN</Region>
      <CEO>Benson Baptist</CEO>
      <Office>
        <Department>Services</Department>
        <Manager>
          <Name>Allayne Kornyakov</Name>
          <Address>56 Arrowood Avenue</Address>
        </Manager>
      </Office>
    </COMPANYINFO>
    <COMPANYINFO>
      <CompInfoId>03-253-2290</CompInfoId>
      <City>Amarillo</City>
      <Address>Duke</Address>
      <Zip>79171</Zip>
      <Region>TX</Region>
      <CEO>Karoline Whaley</CEO>
      <Office>
        <Department>Training</Department>
        <Manager>
          <Name>Courtenay McRorie</Name>
          <Address>2 Kingsford Hill</Address>
        </Manager>
        <Manager>
          <Name>Terrie Jacmar</Name>
          <Address>9 Butternut Point</Address>
        </Manager>
      </Office>
      <Office>
        <Department>Human Resources</Department>
        <Manager>
          <Name>Kissee Folkes</Name>
          <Address>9 Nevada Hill</Address>
        </Manager>
        <Manager>
          <Name>Barny Heditch</Name>
          <Address>65 Truax Way</Address>
        </Manager>
      </Office>
    </COMPANYINFO>
    <COMPANYINFO>
      <CompInfoId>47-934-9759</CompInfoId>
      <City>Las Vegas</City>
      <Address>Butterfield</Address>
      <Zip>89150</Zip>
      <Region>NV</Region>
      <CEO>Britteny Cordsen</CEO>
      <Office>
        <Department>Accounting</Department>
        <Manager>
          <Name>Mar Manueau</Name>
          <Address>95 Upham Drive</Address>
        </Manager>
        <Manager>
          <Name>Tades Novello</Name>
          <Address>168 Division Street</Address>
        </Manager>
      </Office>
      <Office>
        <Department>Product Management</Department>
        <Manager>
          <Name>Tod Giacobazzi</Name>
          <Address>92775 Dryden Junction</Address>
        </Manager>
      </Office>
    </COMPANYINFO>
  </CompanyInformation>
  <CompanyInformation>
    <CompId>2</CompId>
    <CompRegionId>1035</CompRegionId>
    <CompTransPort>Infiniti</CompTransPort>
    <CompanyStreet>Trailsway</CompanyStreet>
    <COMPANYINFO>
      <CompInfoId>56-447-0646</CompInfoId>
      <City>Des Moines</City>
      <Address>Red Cloud</Address>
      <Zip>50362</Zip>
      <Region>IA</Region>
      <CEO>Kamila Scotland</CEO>
      <Office>
        <Department>Human Resources</Department>
        <Manager>
          <Name>Brittaney Mantripp</Name>
          <Address>31 Dorton Center</Address>
        </Manager>
      </Office>
      <Office>
        <Department>Sales</Department>
        <Manager>
          <Name>Tarrance Tildesley</Name>
          <Address>480 Columbus Court</Address>
        </Manager>
        <Manager>
          <Name>Missie Henniger</Name>
          <Address>591 Sloan Plaza</Address>
        </Manager>
      </Office>
      <Office>
        <Department>Training</Department>
        <Manager>
          <Name>Gaston Duxfield</Name>
          <Address>8704 Center Alley</Address>
        </Manager>
        <Manager>
          <Name>Keeley Studman</Name>
          <Address>105 Westend Park</Address>
        </Manager>
      </Office>
    </COMPANYINFO>
    <COMPANYINFO>
      <CompInfoId>76-519-4787</CompInfoId>
      <City>Pensacola</City>
      <Address>Derek</Address>
      <Zip>32590</Zip>
      <Region>FL</Region>
      <CEO>Faye Corrado</CEO>
      <Office>
        <Department>Human Resources</Department>
        <Manager>
          <Name>Sasha Sandars</Name>
          <Address>099 3rd Street</Address>
        </Manager>
      </Office>
      <Office>
        <Department>Services</Department>
        <Manager>
          <Name>Netty Sarfass</Name>
          <Address>28 Dakota Parkway</Address>
        </Manager>
        <Manager>
          <Name>Noll Hasley</Name>
          <Address>7 Buena Vista Place</Address>
        </Manager>
      </Office>
    </COMPANYINFO>
    <COMPANYINFO>
      <CompInfoId>53-012-2210</CompInfoId>
      <City>Olympia</City>
      <Address>Derek</Address>
      <Zip>98516</Zip>
      <Region>WA</Region>
      <CEO>Heinrik Canet</CEO>
      <Office>
        <Department>Research and Development</Department>
        <Manager>
          <Name>Elianora Boothroyd</Name>
          <Address>6970 Fremont Lane</Address>
        </Manager>
      </Office>
      <Office>
        <Department>Accounting</Department>
        <Manager>
          <Name>Ethe Lory</Name>
          <Address>772 Bultman Circle</Address>
        </Manager>
        <Manager>
          <Name>Asia Wasylkiewicz</Name>
          <Address>3 Spohn Drive</Address>
        </Manager>
      </Office>
      <Office>
        <Department>Human Resources</Department>
        <Manager>
          <Name>Cecil Flounders</Name>
          <Address>0 Fair Oaks Lane</Address>
        </Manager>
        <Manager>
          <Name>Tabatha Meldrum</Name>
          <Address>666 Oak Valley Hill</Address>
        </Manager>
      </Office>
    </COMPANYINFO>
  </CompanyInformation>
  <CompanyInformation>
    <CompId>3</CompId>
    <CompRegionId>1070</CompRegionId>
    <CompTransPort>GMC</CompTransPort>
    <CompanyStreet>Forest</CompanyStreet>
    <COMPANYINFO>
      <CompInfoId>79-002-0618</CompInfoId>
      <City>El Paso</City>
      <Address>Eagan</Address>
      <Zip>88563</Zip>
      <Region>TX</Region>
      <CEO>Amalle Tweedlie</CEO>
      <Office>
        <Department>Human Resources</Department>
        <Manager>
          <Name>Glori Mishaw</Name>
          <Address>89 Rutledge Point</Address>
        </Manager>
      </Office>
      <Office>
        <Department>Sales</Department>
        <Manager>
          <Name>Rossy Skally</Name>
          <Address>19 Morningstar Pass</Address>
        </Manager>
        <Manager>
          <Name>Nanci Lillow</Name>
          <Address>913 Blue Bill Park Lane</Address>
        </Manager>
      </Office>
      <Office>
        <Department>Human Resources</Department>
        <Manager>
          <Name>Celle Stodhart</Name>
          <Address>73 Starling Circle</Address>
        </Manager>
        <Manager>
          <Name>Xylina Josselson</Name>
          <Address>46 Hanover Crossing</Address>
        </Manager>
      </Office>
    </COMPANYINFO>
    <COMPANYINFO>
      <CompInfoId>07-502-7278</CompInfoId>
      <City>North Hollywood</City>
      <Address>Stone Corner</Address>
      <Zip>91616</Zip>
      <Region>CA</Region>
      <CEO>Art Eschelle</CEO>
      <Office>
        <Department>Marketing</Department>
        <Manager>
          <Name>Suzy Crehan</Name>
          <Address>835 American Ash Avenue</Address>
        </Manager>
      </Office>
    </COMPANYINFO>
    <COMPANYINFO>
      <CompInfoId>31-050-0482</CompInfoId>
      <City>Sioux Falls</City>
      <Address>Thackeray</Address>
      <Zip>57193</Zip>
      <Region>SD</Region>
      <CEO>Far Lambot</CEO>
      <Office>
        <Department>Engineering</Department>
        <Manager>
          <Name>Warren Salterne</Name>
          <Address>4584 Weeping Birch Drive</Address>
        </Manager>
        <Manager>
          <Name>Felipe La Torre</Name>
          <Address>8 Randy Drive</Address>
        </Manager>
      </Office>
    </COMPANYINFO>
  </CompanyInformation>
  <CompanyInformation>
    <CompId>4</CompId>
    <CompRegionId>1105</CompRegionId>
    <CompTransPort>Honda</CompTransPort>
    <CompanyStreet>Gerald</CompanyStreet>
    <COMPANYINFO>
      <CompInfoId>74-908-0730</CompInfoId>
      <City>Richmond</City>
      <Address>Northport</Address>
      <Zip>23225</Zip>
      <Region>VA</Region>
      <CEO>Kristen Jindra</CEO>
      <Office>
        <Department>Services</Department>
        <Manager>
          <Name>Rozina Meys</Name>
          <Address>20829 Kipling Terrace</Address>
        </Manager>
      </Office>
      <Office>
        <Department>Sales</Department>
        <Manager>
          <Name>Mischa Vasile</Name>
          <Address>87377 Clove Point</Address>
        </Manager>
        <Manager>
          <Name>Robin Greggs</Name>
          <Address>07 Atwood Place</Address>
        </Manager>
      </Office>
      <Office>
        <Department>Training</Department>
        <Manager>
          <Name>Flossi Cowup</Name>
          <Address>12016 Coolidge Terrace</Address>
        </Manager>
      </Office>
    </COMPANYINFO>
    <COMPANYINFO>
      <CompInfoId>77-155-1754</CompInfoId>
      <City>Honolulu</City>
      <Address>Westerfield</Address>
      <Zip>96840</Zip>
      <Region>HI</Region>
      <CEO>Rosella Frayling</CEO>
      <Office>
        <Department>Business Development</Department>
        <Manager>
          <Name>Kayle Winsborrow</Name>
          <Address>5172 Katie Trail</Address>
        </Manager>
      </Office>
      <Office>
        <Department>Business Development</Department>
        <Manager>
          <Name>Lynna Izkovitch</Name>
          <Address>42316 Hoard Drive</Address>
        </Manager>
        <Manager>
          <Name>Esme Hulett</Name>
          <Address>40 Dapin Lane</Address>
        </Manager>
      </Office>
      <Office>
        <Department>Accounting</Department>
        <Manager>
          <Name>Lenard Artus</Name>
          <Address>9294 Hudson Trail</Address>
        </Manager>
      </Office>
    </COMPANYINFO>
    <COMPANYINFO>
      <CompInfoId>97-855-1514</CompInfoId>
      <City>Van Nuys</City>
      <Address>Ryan</Address>
      <Zip>91499</Zip>
      <Region>CA</Region>
      <CEO>Marcel Leemans</CEO>
      <Office>
        <Department>Training</Department>
        <Manager>
          <Name>Licha Guilloux</Name>
          <Address>3 Darwin Parkway</Address>
        </Manager>
        <Manager>
          <Name>Trumann Stallon</Name>
          <Address>74 Caliangt Pass</Address>
        </Manager>
      </Office>
      <Office>
        <Department>Services</Department>
        <Manager>
          <Name>Linet Arboine</Name>
          <Address>6 Tennessee Pass</Address>
        </Manager>
        <Manager>
          <Name>Isabeau Cowell</Name>
          <Address>073 Redwing Avenue</Address>
        </Manager>
      </Office>
    </COMPANYINFO>
  </CompanyInformation>
  <CompanyInformation>
    <CompId>5</CompId>
    <CompRegionId>1140</CompRegionId>
    <CompTransPort>Lincoln</CompTransPort>
    <CompanyStreet>Lillian</CompanyStreet>
    <COMPANYINFO>
      <CompInfoId>98-329-3445</CompInfoId>
      <City>Glendale</City>
      <Address>Mandrake</Address>
      <Zip>91205</Zip>
      <Region>CA</Region>
      <CEO>Coral Honatsch</CEO>
      <Office>
        <Department>Business Development</Department>
        <Manager>
          <Name>Windy Medley</Name>
          <Address>17 Columbus Point</Address>
        </Manager>
      </Office>
      <Office>
        <Department>Training</Department>
        <Manager>
          <Name>Mercy Vayro</Name>
          <Address>66121 Sage Street</Address>
        </Manager>
      </Office>
      <Office>
        <Department>Human Resources</Department>
        <Manager>
          <Name>Tish Thying</Name>
          <Address>21 Red Cloud Avenue</Address>
        </Manager>
        <Manager>
          <Name>Micki Yokel</Name>
          <Address>238 Nevada Point</Address>
        </Manager>
      </Office>
    </COMPANYINFO>
    <COMPANYINFO>
      <CompInfoId>49-706-4885</CompInfoId>
      <City>Salt Lake City</City>
      <Address>Everett</Address>
      <Zip>84105</Zip>
      <Region>UT</Region>
      <CEO>Addie Voaden</CEO>
      <Office>
        <Department>Sales</Department>
        <Manager>
          <Name>Jed Rountree</Name>
          <Address>7 Delaware Point</Address>
        </Manager>
      </Office>
      <Office>
        <Department>Services</Department>
        <Manager>
          <Name>Tiffanie Whye</Name>
          <Address>81 Butterfield Circle</Address>
        </Manager>
      </Office>
    </COMPANYINFO>
    <COMPANYINFO>
      <CompInfoId>25-459-2055</CompInfoId>
      <City>Marietta</City>
      <Address>Mcguire</Address>
      <Zip>30066</Zip>
      <Region>GA</Region>
      <CEO>Clarie Berrow</CEO>
      <Office>
        <Department>Support</Department>
        <Manager>
          <Name>Ive Marques</Name>
          <Address>81019 Fair Oaks Terrace</Address>
        </Manager>
      </Office>
      <Office>
        <Department>Services</Department>
        <Manager>
          <Name>Cirilo Danilewicz</Name>
          <Address>2 Maple Court</Address>
        </Manager>
      </Office>
    </COMPANYINFO>
  </CompanyInformation>
  <CompanyInformation>
    <CompId>6</CompId>
    <CompRegionId>1175</CompRegionId>
    <CompTransPort>Volkswagen</CompTransPort>
    <CompanyStreet>Lillian</CompanyStreet>
    <COMPANYINFO>
      <CompInfoId>02-373-6638</CompInfoId>
      <City>Aurora</City>
      <Address>Maywood</Address>
      <Zip>80044</Zip>
      <Region>CO</Region>
      <CEO>Willa Soda</CEO>
      <Office>
        <Department>Accounting</Department>
        <Manager>
          <Name>Crissy Dahler</Name>
          <Address>454 Kings Junction</Address>
        </Manager>
      </Office>
    </COMPANYINFO>
    <COMPANYINFO>
      <CompInfoId>67-617-3208</CompInfoId>
      <City>Portland</City>
      <Address>Dawn</Address>
      <Zip>97232</Zip>
      <Region>OR</Region>
      <CEO>Rock Kaine</CEO>
      <Office>
        <Department>Sales</Department>
        <Manager>
          <Name>Ly McSorley</Name>
          <Address>7541 Golf View Way</Address>
        </Manager>
      </Office>
    </COMPANYINFO>
  </CompanyInformation>
  <CompanyInformation>
    <CompId>7</CompId>
    <CompRegionId>1210</CompRegionId>
    <CompTransPort>Nissan</CompTransPort>
    <CompanyStreet>Raven</CompanyStreet>
    <COMPANYINFO>
      <CompInfoId>26-734-2319</CompInfoId>
      <City>Norfolk</City>
      <Address>Pawling</Address>
      <Zip>23514</Zip>
      <Region>VA</Region>
      <CEO>Donella Lingley</CEO>
      <Office>
        <Department>Research and Development</Department>
        <Manager>
          <Name>Hazel Wordley</Name>
          <Address>25586 Bobwhite Avenue</Address>
        </Manager>
        <Manager>
          <Name>Sterne Elwood</Name>
          <Address>1 Maryland Point</Address>
        </Manager>
      </Office>
      <Office>
        <Department>Product Management</Department>
        <Manager>
          <Name>Giacinta Couper</Name>
          <Address>24331 Golf View Crossing</Address>
        </Manager>
        <Manager>
          <Name>Lark Vonderdell</Name>
          <Address>75 Walton Terrace</Address>
        </Manager>
      </Office>
      <Office>
        <Department>Engineering</Department>
        <Manager>
          <Name>Robinette Duxbarry</Name>
          <Address>40008 Tomscot Hill</Address>
        </Manager>
        <Manager>
          <Name>Alis Sonnenschein</Name>
          <Address>6655 Westerfield Parkway</Address>
        </Manager>
      </Office>
    </COMPANYINFO>
    <COMPANYINFO>
      <CompInfoId>51-401-2534</CompInfoId>
      <City>El Paso</City>
      <Address>Boyd</Address>
      <Zip>88535</Zip>
      <Region>TX</Region>
      <CEO>Sheeree Mosby</CEO>
      <Office>
        <Department>Services</Department>
        <Manager>
          <Name>Jon Bearns</Name>
          <Address>66770 Jenifer Drive</Address>
        </Manager>
      </Office>
      <Office>
        <Department>Marketing</Department>
        <Manager>
          <Name>Carroll Kerswell</Name>
          <Address>3 La Follette Way</Address>
        </Manager>
        <Manager>
          <Name>Trudey Cowwell</Name>
          <Address>56083 Dahle Plaza</Address>
        </Manager>
      </Office>
      <Office>
        <Department>Marketing</Department>
        <Manager>
          <Name>Delilah Mawby</Name>
          <Address>5 Bunting Drive</Address>
        </Manager>
      </Office>
    </COMPANYINFO>
    <COMPANYINFO>
      <CompInfoId>85-987-6944</CompInfoId>
      <City>Washington</City>
      <Address>Raven</Address>
      <Zip>20575</Zip>
      <Region>DC</Region>
      <CEO>Mariel Cordery</CEO>
      <Office>
        <Department>Research and Development</Department>
        <Manager>
          <Name>Fran Hedaux</Name>
          <Address>178 Waywood Circle</Address>
        </Manager>
      </Office>
      <Office>
        <Department>Engineering</Department>
        <Manager>
          <Name>Roselin Braban</Name>
          <Address>46183 Donald Court</Address>
        </Manager>
      </Office>
    </COMPANYINFO>
    <COMPANYINFO>
      <CompInfoId>16-370-9054</CompInfoId>
      <City>Phoenix</City>
      <Address>Westport</Address>
      <Zip>85083</Zip>
      <Region>AZ</Region>
      <CEO>Armando Swayland</CEO>
      <Office>
        <Department>Engineering</Department>
        <Manager>
          <Name>Ruthi Eccles</Name>
          <Address>68490 Pierstorff Drive</Address>
        </Manager>
      </Office>
    </COMPANYINFO>
  </CompanyInformation>
  <CompanyInformation>
    <CompId>8</CompId>
    <CompRegionId>1245</CompRegionId>
    <CompTransPort>Hyundai</CompTransPort>
    <CompanyStreet>Paget</CompanyStreet>
    <COMPANYINFO>
      <CompInfoId>88-021-6481</CompInfoId>
      <City>San Diego</City>
      <Address>Darwin</Address>
      <Zip>92176</Zip>
      <Region>CA</Region>
      <CEO>Virgina Jansie</CEO>
      <Office>
        <Department>Research and Development</Department>
        <Manager>
          <Name>Laurene Chown</Name>
          <Address>783 Buena Vista Way</Address>
        </Manager>
        <Manager>
          <Name>Tressa La Torre</Name>
          <Address>89 Petterle Point</Address>
        </Manager>
      </Office>
      <Office>
        <Department>Sales</Department>
        <Manager>
          <Name>Yalonda Stirrip</Name>
          <Address>5 Boyd Crossing</Address>
        </Manager>
        <Manager>
          <Name>Parnell Jennrich</Name>
          <Address>8985 Northview Street</Address>
        </Manager>
      </Office>
      <Office>
        <Department>Accounting</Department>
        <Manager>
          <Name>Cooper Chardin</Name>
          <Address>62 Del Mar Court</Address>
        </Manager>
      </Office>
    </COMPANYINFO>
    <COMPANYINFO>
      <CompInfoId>84-997-6651</CompInfoId>
      <City>Charleston</City>
      <Address>Sachs</Address>
      <Zip>29424</Zip>
      <Region>SC</Region>
      <CEO>Chelsie Midghall</CEO>
      <Office>
        <Department>Support</Department>
        <Manager>
          <Name>Ardys Tyt</Name>
          <Address>22998 Monterey Terrace</Address>
        </Manager>
        <Manager>
          <Name>Edd Harling</Name>
          <Address>004 Morrow Street</Address>
        </Manager>
      </Office>
    </COMPANYINFO>
    <COMPANYINFO>
      <CompInfoId>93-553-2808</CompInfoId>
      <City>Dallas</City>
      <Address>John Wall</Address>
      <Zip>75358</Zip>
      <Region>TX</Region>
      <CEO>Baird Coolbear</CEO>
      <Office>
        <Department>Product Management</Department>
        <Manager>
          <Name>Cully Kochlin</Name>
          <Address>56829 Talmadge Avenue</Address>
        </Manager>
        <Manager>
          <Name>Alasdair Nuemann</Name>
          <Address>20636 Straubel Pass</Address>
        </Manager>
      </Office>
      <Office>
        <Department>Services</Department>
        <Manager>
          <Name>Otho Chadney</Name>
          <Address>694 Gulseth Crossing</Address>
        </Manager>
        <Manager>
          <Name>Dori Wallwork</Name>
          <Address>1408 Grayhawk Alley</Address>
        </Manager>
      </Office>
    </COMPANYINFO>
  </CompanyInformation>
  <CompanyInformation>
    <CompId>9</CompId>
    <CompRegionId>1280</CompRegionId>
    <CompTransPort>Kia</CompTransPort>
    <CompanyStreet>Basil</CompanyStreet>
    <COMPANYINFO>
      <CompInfoId>67-591-8586</CompInfoId>
      <City>Anaheim</City>
      <Address>Gulseth</Address>
      <Zip>92812</Zip>
      <Region>CA</Region>
      <CEO>Eldon Donkersley</CEO>
      <Office>
        <Department>Human Resources</Department>
        <Manager>
          <Name>Adrianne Showl</Name>
          <Address>35394 Bartelt Pass</Address>
        </Manager>
      </Office>
      <Office>
        <Department>Product Management</Department>
        <Manager>
          <Name>Winfred Yate</Name>
          <Address>3703 Fieldstone Hill</Address>
        </Manager>
        <Manager>
          <Name>Julietta Liddiard</Name>
          <Address>80405 Brentwood Trail</Address>
        </Manager>
      </Office>
    </COMPANYINFO>
    <COMPANYINFO>
      <CompInfoId>89-724-6685</CompInfoId>
      <City>Columbia</City>
      <Address>Birchwood</Address>
      <Zip>29240</Zip>
      <Region>SC</Region>
      <CEO>Nessie Elfe</CEO>
      <Office>
        <Department>Accounting</Department>
        <Manager>
          <Name>Corena Gawthorpe</Name>
          <Address>75 Del Sol Drive</Address>
        </Manager>
        <Manager>
          <Name>Astrid Grinsted</Name>
          <Address>3964 Portage Point</Address>
        </Manager>
      </Office>
      <Office>
        <Department>Legal</Department>
        <Manager>
          <Name>Jordana Windram</Name>
          <Address>59 Jana Pass</Address>
        </Manager>
      </Office>
      <Office>
        <Department>Engineering</Department>
        <Manager>
          <Name>Bengt Bubbins</Name>
          <Address>62 Schiller Hill</Address>
        </Manager>
      </Office>
    </COMPANYINFO>
  </CompanyInformation>
  <CompanyInformation>
    <CompId>10</CompId>
    <CompRegionId>1315</CompRegionId>
    <CompTransPort>Lincoln</CompTransPort>
    <CompanyStreet>Green</CompanyStreet>
    <COMPANYINFO>
      <CompInfoId>72-787-2989</CompInfoId>
      <City>Newark</City>
      <Address>Lakewood Gardens</Address>
      <Zip>07112</Zip>
      <Region>NJ</Region>
      <CEO>Mickie Jerrand</CEO>
      <Office>
        <Department>Product Management</Department>
        <Manager>
          <Name>Shanna Waszkiewicz</Name>
          <Address>45 Iowa Way</Address>
        </Manager>
      </Office>
      <Office>
        <Department>Business Development</Department>
        <Manager>
          <Name>Benton Coucha</Name>
          <Address>513 Sycamore Point</Address>
        </Manager>
        <Manager>
          <Name>Gerry Fidgeon</Name>
          <Address>827 Lotheville Avenue</Address>
        </Manager>
      </Office>
    </COMPANYINFO>
    <COMPANYINFO>
      <CompInfoId>63-826-7755</CompInfoId>
      <City>Staten Island</City>
      <Address>Red Cloud</Address>
      <Zip>10305</Zip>
      <Region>NY</Region>
      <CEO>Cassius Edgecumbe</CEO>
      <Office>
        <Department>Training</Department>
        <Manager>
          <Name>Chloris Tatterton</Name>
          <Address>695 Holy Cross Terrace</Address>
        </Manager>
        <Manager>
          <Name>Johann Pickerill</Name>
          <Address>28 Hanover Center</Address>
        </Manager>
      </Office>
      <Office>
        <Department>Services</Department>
        <Manager>
          <Name>Edsel Heasman</Name>
          <Address>8 Duke Street</Address>
        </Manager>
        <Manager>
          <Name>Allyn Veeler</Name>
          <Address>17 Pankratz Plaza</Address>
        </Manager>
      </Office>
      <Office>
        <Department>Research and Development</Department>
        <Manager>
          <Name>Eleonore McDermott-Row</Name>
          <Address>02523 Raven Avenue</Address>
        </Manager>
        <Manager>
          <Name>Janice Dibdall</Name>
          <Address>368 Troy Trail</Address>
        </Manager>
      </Office>
    </COMPANYINFO>
    <COMPANYINFO>
      <CompInfoId>91-768-7117</CompInfoId>
      <City>Sacramento</City>
      <Address>Esker</Address>
      <Zip>94280</Zip>
      <Region>CA</Region>
      <CEO>Isidore Shippam</CEO>
      <Office>
        <Department>Support</Department>
        <Manager>
          <Name>Sibyl Hinckesman</Name>
          <Address>52054 Armistice Avenue</Address>
        </Manager>
        <Manager>
          <Name>Winny Tarling</Name>
          <Address>39183 Bartelt Center</Address>
        </Manager>
      </Office>
      <Office>
        <Department>Accounting</Department>
        <Manager>
          <Name>Katharina Petford</Name>
          <Address>7821 Butternut Crossing</Address>
        </Manager>
      </Office>
      <Office>
        <Department>Business Development</Department>
        <Manager>
          <Name>Valeria Isselee</Name>
          <Address>4903 Sutteridge Point</Address>
        </Manager>
      </Office>
    </COMPANYINFO>
    <COMPANYINFO>
      <CompInfoId>16-019-0328</CompInfoId>
      <City>Tucson</City>
      <Address>Arrowood</Address>
      <Zip>85720</Zip>
      <Region>AZ</Region>
      <CEO>Zechariah Leman</CEO>
      <Office>
        <Department>Marketing</Department>
        <Manager>
          <Name>Kean Titman</Name>
          <Address>134 Melrose Way</Address>
        </Manager>
      </Office>
    </COMPANYINFO>
  </CompanyInformation>
  <CompanyInformation>
    <CompId>11</CompId>
    <CompRegionId>1350</CompRegionId>
    <CompTransPort>Mitsubishi</CompTransPort>
    <CompanyStreet>Delaware</CompanyStreet>
    <COMPANYINFO>
      <CompInfoId>62-253-1099</CompInfoId>
      <City>Memphis</City>
      <Address>Clemons</Address>
      <Zip>38150</Zip>
      <Region>TN</Region>
      <CEO>Charmain Guice</CEO>
      <Office>
        <Department>Marketing</Department>
        <Manager>
          <Name>Minor Rookwell</Name>
          <Address>49027 Bultman Crossing</Address>
        </Manager>
        <Manager>
          <Name>Giff Davidde</Name>
          <Address>8 Arapahoe Place</Address>
        </Manager>
      </Office>
    </COMPANYINFO>
    <COMPANYINFO>
      <CompInfoId>46-828-2699</CompInfoId>
      <City>Houston</City>
      <Address>Maywood</Address>
      <Zip>77015</Zip>
      <Region>TX</Region>
      <CEO>Davidde Sivewright</CEO>
      <Office>
        <Department>Business Development</Department>
        <Manager>
          <Name>Oralie Loftie</Name>
          <Address>84 Burning Wood Terrace</Address>
        </Manager>
      </Office>
      <Office>
        <Department>Marketing</Department>
        <Manager>
          <Name>Scarlet Astlet</Name>
          <Address>906 Sage Lane</Address>
        </Manager>
      </Office>
      <Office>
        <Department>Sales</Department>
        <Manager>
          <Name>Bruis Dillinton</Name>
          <Address>33 Miller Center</Address>
        </Manager>
      </Office>
    </COMPANYINFO>
  </CompanyInformation>
  <CompanyInformation>
    <CompId>12</CompId>
    <CompRegionId>1385</CompRegionId>
    <CompTransPort>Ford</CompTransPort>
    <CompanyStreet>Huxley</CompanyStreet>
    <COMPANYINFO>
      <CompInfoId>93-633-9109</CompInfoId>
      <City>Las Vegas</City>
      <Address>Elgar</Address>
      <Zip>89145</Zip>
      <Region>NV</Region>
      <CEO>Rodina Audry</CEO>
      <Office>
        <Department>Services</Department>
        <Manager>
          <Name>Marieann Abelwhite</Name>
          <Address>76437 Helena Center</Address>
        </Manager>
        <Manager>
          <Name>Emeline Biernat</Name>
          <Address>38318 Butternut Circle</Address>
        </Manager>
      </Office>
    </COMPANYINFO>
    <COMPANYINFO>
      <CompInfoId>58-396-8623</CompInfoId>
      <City>Jackson</City>
      <Address>Towne</Address>
      <Zip>39282</Zip>
      <Region>MS</Region>
      <CEO>Silvio Gooderridge</CEO>
      <Office>
        <Department>Services</Department>
        <Manager>
          <Name>Maurita Elgy</Name>
          <Address>28 Waxwing Center</Address>
        </Manager>
        <Manager>
          <Name>Filbert Slimon</Name>
          <Address>215 Tennessee Drive</Address>
        </Manager>
      </Office>
      <Office>
        <Department>Accounting</Department>
        <Manager>
          <Name>Alana Bottinelli</Name>
          <Address>93 Lerdahl Court</Address>
        </Manager>
        <Manager>
          <Name>Chris Godsell</Name>
          <Address>69 Grayhawk Drive</Address>